{
  "$schema": "https://opencode.ai/desktop-theme.json",
  "name": "Night Owl",
  "id": "nightowl",
  "light": {
    "seeds": {
      "neutral": "#f0f0f0",
      "primary": "#4876d6",
      "accent": "#aa0982",
      "success": "#2aa298",
      "warning": "#c96765",
      "error": "#de3d3b",
      "info": "#4876d6",
      "diffAdd": "#2aa298",
      "diffDelete": "#de3d3b"
    },
    "overrides": {
      "syntax-comment": "#7a8181",
      "syntax-keyword": "#994cc3",
      "syntax-primitive": "#4876d6",
      "syntax-constant": "#c96765"
    }
  },
  "dark": {
    "seeds": {
      "neutral": "#011627",
      "primary": "#82aaff",
      "accent": "#f78c6c",
      "success": "#c5e478",
      "warning": "#ecc48d",
      "error": "#ef5350",
      "info": "#82aaff",
      "diffAdd": "#c5e478",
      "diffDelete": "#ef5350"
    },
    "overrides": {
      "syntax-comment": "#637777",
      "syntax-keyword": "#c792ea",
      "syntax-string": "#ecc48d",
      "syntax-primitive": "#82aaff",
      "syntax-constant": "#f78c6c"
    }
  }
}
