{
  "$schema": "https://opencode.ai/desktop-theme.json",
  "name": "One Dark Pro",
  "id": "onedarkpro",
  "light": {
    "seeds": {
      "neutral": "#f5f6f8",
      "primary": "#528bff",
      "accent": "#d85462",
      "success": "#4fa66d",
      "warning": "#d19a66",
      "error": "#e06c75",
      "info": "#61afef",
      "diffAdd": "#c2ebcf",
      "diffDelete": "#f7c1c5"
    },
    "overrides": {
      "syntax-comment": "#6a717d",
      "syntax-keyword": "#a626a4",
      "syntax-primitive": "#4078f2",
      "syntax-constant": "#986801"
    }
  },
  "dark": {
    "seeds": {
      "neutral": "#1e222a",
      "primary": "#61afef",
      "accent": "#e06c75",
      "success": "#98c379",
      "warning": "#e5c07b",
      "error": "#e06c75",
      "info": "#56b6c2",
      "diffAdd": "#4b815a",
      "diffDelete": "#b2555f"
    },
    "overrides": {
      "syntax-comment": "#5c6370",
      "syntax-keyword": "#c678dd",
      "syntax-primitive": "#61afef",
      "syntax-constant": "#d19a66"
    }
  }
}
