{
  "$schema": "https://opencode.ai/desktop-theme.json",
  "name": "Matrix",
  "id": "matrix",
  "light": {
    "seeds": {
      "neutral": "#eef3ea",
      "primary": "#1cc24b",
      "accent": "#c770ff",
      "success": "#1cc24b",
      "warning": "#e6ff57",
      "error": "#ff4b4b",
      "info": "#30b3ff",
      "interactive": "#30b3ff",
      "diffAdd": "#5dac7e",
      "diffDelete": "#d53a3a"
    },
    "overrides": {
      "text-weak": "#748476",
      "syntax-comment": "#748476",
      "syntax-keyword": "#c770ff",
      "syntax-string": "#1cc24b",
      "syntax-primitive": "#30b3ff",
      "syntax-variable": "#203022",
      "syntax-property": "#24f6d9",
      "syntax-type": "#e6ff57",
      "syntax-constant": "#ffa83d",
      "syntax-operator": "#24f6d9",
      "syntax-punctuation": "#203022",
      "syntax-object": "#203022",
      "markdown-heading": "#24f6d9",
      "markdown-text": "#203022",
      "markdown-link": "#30b3ff",
      "markdown-link-text": "#24f6d9",
      "markdown-code": "#1cc24b",
      "markdown-block-quote": "#748476",
      "markdown-emph": "#ffa83d",
      "markdown-strong": "#e6ff57",
      "markdown-horizontal-rule": "#748476",
      "markdown-list-item": "#30b3ff",
      "markdown-list-enumeration": "#24f6d9",
      "markdown-image": "#30b3ff",
      "markdown-image-text": "#24f6d9",
      "markdown-code-block": "#203022"
    }
  },
  "dark": {
    "seeds": {
      "neutral": "#0a0e0a",
      "primary": "#2eff6a",
      "accent": "#c770ff",
      "success": "#62ff94",
      "warning": "#e6ff57",
      "error": "#ff4b4b",
      "info": "#30b3ff",
      "interactive": "#30b3ff",
      "diffAdd": "#77ffaf",
      "diffDelete": "#ff7171"
    },
    "overrides": {
      "text-weak": "#8ca391",
      "syntax-comment": "#8ca391",
      "syntax-keyword": "#c770ff",
      "syntax-string": "#1cc24b",
      "syntax-primitive": "#30b3ff",
      "syntax-variable": "#62ff94",
      "syntax-property": "#24f6d9",
      "syntax-type": "#e6ff57",
      "syntax-constant": "#ffa83d",
      "syntax-operator": "#24f6d9",
      "syntax-punctuation": "#62ff94",
      "syntax-object": "#62ff94",
      "markdown-heading": "#00efff",
      "markdown-text": "#62ff94",
      "markdown-link": "#30b3ff",
      "markdown-link-text": "#24f6d9",
      "markdown-code": "#1cc24b",
      "markdown-block-quote": "#8ca391",
      "markdown-emph": "#ffa83d",
      "markdown-strong": "#e6ff57",
      "markdown-horizontal-rule": "#8ca391",
      "markdown-list-item": "#30b3ff",
      "markdown-list-enumeration": "#24f6d9",
      "markdown-image": "#30b3ff",
      "markdown-image-text": "#24f6d9",
      "markdown-code-block": "#62ff94"
    }
  }
}
